cluster_id,display_id,rank_by_sv,is_noise,label_de,label_en,n_keywords,total_search_volume,median_search_volume,mean_kd,median_kd,mean_cpc_eur,mean_priority,pct_commercial,intent_dominant,top_keywords_by_sv,top_keywords_by_priority,top_terms,brief_title,brief_main_keyword,brief_secondary_keywords,brief_search_intent_text,brief_recommended_word_count,brief_target_audience,brief_pain_point,brief_article_goal,brief_h1,brief_h2_outline,brief_content_gaps,brief_benchmark_urls,brief_cta,brief_source_path,brief_md_path
10,11,1,false,HR Software Dokumentenverwaltung und Mitarbeiterverwaltung,HR Software Document and Employee Management,45,45567,262,52.5,52,6.47,16.9,89.0,commercial,dokumentenmanagement software | bewerbermanagement software | mitarbeiterverwaltung software | hr software kmu | gehaltsabrechnung software,dokumentenmanagement software | mitarbeiterverwaltung software | hr software kmu,bewerbermanagement | management | facility | vergleich | dokumentenmanagement | mitarbeiterverwaltung,"HR Software für KMU: Mitarbeiterverwaltung, Dokumente und Abrechnung in einer Lösung",hr software kmu,mitarbeiterverwaltung software | dokumentenmanagement software | bewerbermanagement software | gehaltsabrechnung software | ats software | aüg software,"commercial, mixed, Suchende vergleichen aktiv Softwarelösungen und suchen nach einer konsolidierten HR-Plattform, die mehrere Einzeltools ersetzt.",2800,"HR-Leiter oder Geschäftsführer eines deutschen KMU mit 50 bis 500 Mitarbeitern, oft in Zeitarbeit, Gebäudedienstleistung oder Facility Management, der aktuell mit Excel-Listen, Papierordnern oder fragmentierten Einzellösungen arbeitet.","Personalakten liegen in drei verschiedenen Systemen, Lohnabrechnung läuft über eine externe Steuerkanzlei, und Bewerberdaten stecken in E-Mail-Postfächern. Bei einer Betriebsprüfung oder AÜG-Kontrolle dauert es Stunden, die richtigen Dokumente zusammenzusuchen. Gleichzeitig wächst das Team, neue gesetzliche Anforderungen kommen hinzu, und der manuelle Aufwand frisst jede Woche mehrere Arbeitstage.","Der Leser soll verstehen, welche HR-Funktionen eine einzige Plattform abdecken muss, um den Verwaltungsaufwand in KMU spürbar zu senken, und danach eine Demo oder einen direkten Produktvergleich anfragen.","HR Software für KMU: Mitarbeiterverwaltung, Dokumentenmanagement und Gehaltsabrechnung in einer Lösung",Warum KMU an zu vielen HR-Insellösungen scheitern | Kernfunktionen einer HR Software für KMU im Überblick | Besondere Anforderungen in Zeitarbeit und Gebäudedienstleistung | Auswahlkriterien: Worauf KMU beim Softwarevergleich wirklich achten sollten | Typische Fehler beim HR-Software-Kauf in KMU | Checkliste: Das muss eine HR Software für KMU leisten | Fazit und nächste Schritte: So finden KMU die passende Lösung,"Marktführer im deutschen KMU-Segment, hohe Domain Authority, rankt für fast alle Zielkeywords dieses Clusters | starker Inhaltsanbieter mit breiter Keyword-Abdeckung im Bereich Gehaltsabrechnung und Mitarbeiterverwaltung | direkter Wettbewerber mit Fokus auf ATS und Bewerbermanagement für den deutschen Mittelstand","https://www.personio.de/hr-software/ — Marktführer im deutschen KMU-Segment, hohe Domain Authority, rankt für fast alle Zielkeywords dieses Clusters | https://www.sage.com/de-de/blog/hr-software-kmu/ — starker Inhaltsanbieter mit breiter Keyword-Abdeckung im Bereich Gehaltsabrechnung und Mitarbeiterverwaltung | https://www.rexx-systems.com/hr-software/ — direkter Wettbewerber mit Fokus auf ATS und Bewerbermanagement für den deutschen Mittelstand","Demo von zvoove HR anfordern: zeigen, wie Mitarbeiterverwaltung, Dokumentenmanagement und AÜG-Compliance in einer Plattform funktionieren, inklusive Live-Walkthrough für Zeitarbeit oder Gebäudedienstleistung.",output/briefings/cluster_11.md,briefings/cluster_11.md
12,13,2,false,Sammelthemen Zeitarbeit Software und Finanzierung,Catch-all Staffing Software and Financing,97,28301,131,36.5,35,3.45,7.4,34.0,mixed,zeitarbeit programm | zeitarbeit branche entwicklung | factoring zeitarbeit | crm zeitarbeit | lohnabrechnung zeitarbeit,zeitarbeit programm | zeitarbeit branche entwicklung | factoring zeitarbeit,zeiterfassung | factoring | lohnabrechnung | saas | pflege | dsgvo,"Zeitarbeit Software 2025: CRM, Lohnabrechnung, Einsatzplanung und Factoring in einer Plattform",zeitarbeit programm,crm zeitarbeit | lohnabrechnung zeitarbeit | einsatzplanung zeitarbeit | factoring zeitarbeit | saas zeitarbeit | zeiterfassung zeitarbeit | zeitarbeit branche entwicklung,"mixed, Nutzer vergleichen aktiv Softwarelösungen und informieren sich gleichzeitig über Branchentrends, um eine Kaufentscheidung vorzubereiten.",2800,"Geschäftsführer oder Niederlassungsleiter eines mittelständischen Zeitarbeitsunternehmens mit 50 bis 500 Mitarbeitern auf Abruf, der seine Softwarelandschaft konsolidieren will.","Drei oder vier Insellösungen für Disposition, Lohnabrechnung und CRM fressen täglich Stunden durch manuelle Datenpflege und doppelte Eingaben. Der Margendruck in der Branche wächst, aber das interne Team hat keine Kapazität, einen aufwendigen Systemwechsel zu stemmen. Dazu kommt die Frage der Liquidität: Ohne funktionierendes Factoring fehlt der Puffer, wenn Kunden langsam zahlen und gleichzeitig Löhne fristgerecht raus müssen.","Der Leser soll verstehen, welche Kernmodule eine moderne Zeitarbeit-Software abdecken muss, wie Factoring in den Cashflow-Kreislauf passt, und warum eine integrierte SaaS-Plattform die wirtschaftlichere Wahl gegenüber Einzellösungen ist.",Zeitarbeit Software 2025: Was ein modernes Programm wirklich können muss,"Warum die Zeitarbeitsbranche unter besonderem Softwaredruck steht | Die fünf Kernmodule, die kein Zeitarbeitsunternehmen missen sollte | Factoring in der Zeitarbeit: Wie das Modell funktioniert und was Software leisten muss | SaaS vs. On-Premise: Welches Modell passt zu welcher Unternehmensgröße | Branchenspezifische Anforderungen: Pflege und Handwerk als Sonderfall | Worauf es beim Software-Vergleich wirklich ankommt | Fazit und Marktausblick: Zeitarbeit-Software als strategischer Hebel","deckt Lohnabrechnung und Tarifsysteme ab, rankt auf relevante Longtails, zeigt aber keine Gesamtplattform-Perspektive | hohe Domain Authority, informationaler Content zur Branche, gut zum Verstehen der Suchintention rund um Branchenentwicklung | Haufe-Ratgeberartikel mit Modulübersicht, direkter Wettbewerb bei informationals, aber ohne SaaS- und Factoring-Tiefe","https://www.sage.com/de-de/blog/lohnabrechnung-zeitarbeit/ — deckt Lohnabrechnung und Tarifsysteme ab, rankt auf relevante Longtails, zeigt aber keine Gesamtplattform-Perspektive | https://www.jobware.de/ratgeber/zeitarbeit/ — hohe Domain Authority, informationaler Content zur Branche, gut zum Verstehen der Suchintention rund um Branchenentwicklung | https://www.haufe.de/personal/hr-management/zeitarbeit-software_80_583210.html — Haufe-Ratgeberartikel mit Modulübersicht, direkter Wettbewerb bei informationals, aber ohne SaaS- und Factoring-Tiefe","Demo buchen: Leser werden eingeladen, eine 30-minütige Live-Demo von zvoove zu vereinbaren, in der alle fünf Kernmodule, inklusive der Factoring-Schnittstelle, anhand echter Zeitarbeitsdaten gezeigt werden.",output/briefings/cluster_13.md,briefings/cluster_13.md
1,2,3,false,Zeiterfassung und Zeitarbeitssoftware,Time Tracking and Staffing Software,47,26159,149,47.6,43,6.47,9.3,94.0,commercial,zeiterfassung software | mobile zeiterfassung | zeitarbeitssoftware | roi zeitarbeit software | zeitarbeit software,zeitarbeitssoftware | zeiterfassung software | mobile zeiterfassung,zeiterfassung | cloud | mobile | dsgvo | zeitarbeitssoftware | lohnabrechnung,Zeitarbeitssoftware mit integrierter Zeiterfassung: So wählen Sie die richtige Lösung,zeitarbeitssoftware,zeiterfassung software | mobile zeiterfassung | zeitarbeit software | lohnabrechnung software zeitarbeit | payroll software zeitarbeit | hr software zeitarbeit | mobile zeiterfassung app,"commercial / mixed, Suchende vergleichen aktiv Softwarelösungen und bewerten Funktionsumfang, Preismodelle und ROI vor einer Kaufentscheidung.",2800,"Geschäftsführer oder Niederlassungsleiter eines Zeitarbeitsunternehmens mit 5 bis 50 internen Mitarbeitern und 50 bis 500 aktiven Zeitarbeitnehmern, der seine manuelle Zeiterfassung und Lohnabrechnung endlich zusammenführen will.","Stundenzettel kommen per WhatsApp, per Post oder gar nicht, und am Monatsende verbringt das Team Tage damit, Daten manuell in die Lohnabrechnung zu übertragen. Fehler in der Abrechnung führen zu Beschwerden der Zeitarbeitnehmer, im schlimmsten Fall zu Nachzahlungen und Bußgeldern wegen fehlerhafter Mindestlohndokumentation. Der Geschäftsführer weiß, dass er eine Software braucht, hat aber keine Zeit für einen langen Evaluierungsprozess und ist unsicher, welche Lösung wirklich für Zeitarbeit gebaut ist und nicht nur umgebaut wurde.","Der Leser soll nach dem Lesen die fünf entscheidenden Kriterien kennen, nach denen er Zeitarbeitssoftware mit Zeiterfassung bewertet, und direkt eine Demo oder ein Erstgespräch buchen.",Zeitarbeitssoftware mit integrierter Zeiterfassung: So wählen Sie die richtige Lösung,Warum generische Software für Zeitarbeit nicht funktioniert | Die fünf wichtigsten Funktionen einer guten Zeitarbeitssoftware | Mobile Zeiterfassung in der Praxis: Worauf es wirklich ankommt | ROI und Preismodelle: Was Zeitarbeitssoftware kosten darf | Integration mit Lohnabrechnung und Payroll | Compliance und gesetzliche Anforderungen | Checkliste: So wählen Sie die richtige Lösung in 5 Schritten,"hohe Domain-Autorität, rankt auf generische Zeiterfassungsbegriffe, deckt aber Zeitarbeit-Spezifika nur oberflächlich ab | direkter Wettbewerber im Segment mobile Zeiterfassung, starke SEO-Struktur | Wettbewerber mit HR-Fokus, zeigt wie Funktionstiefe im Artikel als Kaufargument positioniert wird","https://www.sage.com/de-de/blog/zeiterfassung-zeitarbeit/ — hohe Domain-Autorität, rankt auf generische Zeiterfassungsbegriffe, deckt aber Zeitarbeit-Spezifika nur oberflächlich ab | https://www.clockodo.com/de/zeiterfassung-fuer-zeitarbeit/ — direkter Wettbewerber im Segment mobile Zeiterfassung, starke SEO-Struktur | https://www.rexx-systems.com/hr-software/zeitarbeit/ — Wettbewerber mit HR-Fokus, zeigt wie Funktionstiefe im Artikel als Kaufargument positioniert wird","Demo buchen: Zeigen Sie mir, wie zvoove Zeiterfassung, Stundenzettelfreigabe und Lohnabrechnung in einer Plattform verbindet, inklusive Live-Kalkulation des ROI für Ihre Niederlassungsgröße.",output/briefings/cluster_02.md,briefings/cluster_02.md
7,8,4,false,Digitalisierung Personaldienstleistung und KI,Digitalization of HR Services and AI,37,23984,167,35.5,32,3.37,16.8,35.0,mixed,digitalisierung zeitarbeit | digitalisierung personaldienstleistung | künstliche intelligenz personaldienstleistung | digitale zeiterfassung | elektronische lohnabrechnung,digitalisierung zeitarbeit | digitalisierung personaldienstleistung | künstliche intelligenz personaldienstleistung,digital | digitalisierung | lohnabrechnung | digitale | datenschutz | personalakte,Digitalisierung in der Personaldienstleistung: Was wirklich zählt und was nur Buzzword ist,digitalisierung personaldienstleistung,digitalisierung zeitarbeit | künstliche intelligenz personaldienstleistung | digitale personalakte | digitale lohnabrechnung | elektronische lohnabrechnung | revisionssichere archivierung | datenschutz personaldienstleister,"mixed, Entscheider recherchieren sowohl konkrete Lösungen als auch grundlegende Orientierung, bevor sie in Software investieren.",2800,"Geschäftsführer oder Niederlassungsleiter einer mittelständischen Zeitarbeitsfirma mit 5 bis 50 internen Mitarbeitern, die merken, dass ihre Prozesse nicht mehr skalieren.","Jeden Monat kostet die manuelle Lohnabrechnung Stunden, die Fehlerquote steigt mit der Mitarbeiterzahl, und ein einziger Prüfer der Rentenversicherung kann das ganze Kartenhaus zum Einsturz bringen. Gleichzeitig werfen Softwareanbieter mit KI und Automatisierung um sich, ohne zu erklären, was das konkret im Alltag einer Zeitarbeitsfirma bedeutet. Der Entscheider weiß nicht, wo er anfangen soll, und hat Angst, in die falsche Lösung zu investieren.","Der Leser soll nach dem Lesen wissen, welche Digitalisierungsbausteine für Personaldienstleister wirklich praxisrelevant sind, in welcher Reihenfolge er sie angehen sollte, und warum eine integrierte Plattform isolierten Einzellösungen überlegen ist.",Digitalisierung in der Personaldienstleistung: Was wirklich zählt und was nur Buzzword ist,"Warum Personaldienstleister unter besonderem Digitalisierungsdruck stehen | Die fünf Kernbereiche der Digitalisierung im Überblick | Künstliche Intelligenz in der Personaldienstleistung: Hype oder echter Hebel | Sonderfall Gebäudereinigung und gewerbliche Branchen: digitale Besonderheiten | Revisionssichere Archivierung: keine Option, sondern Pflicht | Digitalisierung in Stufen: ein realistischer Fahrplan | Integrierte Plattform vs. Insellösungen: die Kostenfrage","Haufe deckt Compliance-Themen breit ab und rankt für viele informationelle Keywords in diesem Cluster. | Branchenverband mit Studiendaten zur Digitalisierung, relevant als Quellenkonkurrenz und für Verlinkungskontext. | Starker Wettbewerber im Bereich elektronische Lohnabrechnung mit hohem Domain Authority.","https://www.haufe.de/personal/personaldienstleistung — Haufe deckt Compliance-Themen breit ab und rankt für viele informationelle Keywords in diesem Cluster. | https://www.ig-zeitarbeit.de/presse/studien — Branchenverband mit Studiendaten zur Digitalisierung, relevant als Quellenkonkurrenz und für Verlinkungskontext. | https://www.datev.de/web/de/datev-shop/personalwirtschaft/lohn-und-gehalt — Starker Wettbewerber im Bereich elektronische Lohnabrechnung mit hohem Domain Authority.","Demo von zvoove buchen: zeigen, wie digitale Personalakte, Zeiterfassung und Lohnabrechnung in einer Plattform zusammenlaufen, inklusive GoBD-konformer Archivierung ohne Zusatzmodul.",output/briefings/cluster_08.md,briefings/cluster_08.md
3,4,5,false,Zvoove Produkte und Features,Zvoove Products and Features,34,23604,99,52.2,51,6.44,11.2,97.0,commercial,zvoove referenzen | zvoove dms | zvoove cockpit | zvoove payroll | zvoove cashlink,zvoove referenzen | zvoove cashlink | zvoove dms,zvoove | payroll | cashlink | preise | erfahrungen | cockpit,"zvoove im Überblick: Alle Module, Features und echte Kundenstimmen",zvoove one,zvoove referenzen | zvoove dms | zvoove cockpit | zvoove payroll | zvoove recruit | zvoove cashlink | zvoove integration datev | zvoove kunden | zvoove alternative,"commercial, Nutzer kennen zvoove bereits oder evaluieren die Plattform aktiv gegen Alternativen und suchen Produktdetails sowie Kundennachweise zur Kaufentscheidung.",2500,"Geschäftsführer oder Niederlassungsleiter eines mittelständischen Personaldienstleisters mit 50 bis 500 Mitarbeitern, der aktuell eine neue Branchensoftware evaluiert oder sein bestehendes System ablösen will.","Der Entscheider sitzt zwischen Anbietern, die alle dasselbe versprechen, und braucht konkrete Belege statt Hochglanz-Marketing. Er fragt sich, ob zvoove wirklich alle Prozesse abdeckt, also Recruiting, Payroll, DMS und Finanzen in einem System, oder ob er wieder Insellösungen zusammenstückeln muss. Dazu kommt die Sorge, ob eine DATEV-Integration reibungslos funktioniert und ob andere Personaldienstleister in seiner Größe damit tatsächlich produktiv arbeiten.","Der Leser soll nach dem Lesen verstehen, welche zvoove-Module welche konkreten Probleme lösen, und genug Vertrauen aufgebaut haben, um eine Demo anzufragen oder ein Beratungsgespräch zu buchen.","zvoove One: Module, Features und was echte Kunden sagen","Was ist zvoove One und für wen ist es gebaut? | Die zvoove Module im Einzelnen | Integrationen: DATEV, ERP und weitere Schnittstellen | zvoove Referenzen und Kundenstimmen | zvoove Alternative: Wann lohnt sich der Vergleich? | Implementierung und Support: Was erwartet Sie nach dem Kauf? | Fazit und nächste Schritte","Eigene Produktseite als inhaltliche Referenz und Gap-Analyse: Was fehlt dort an Tiefe, das der Artikel liefern kann. | Vergleichsplattform-Inhalte zeigen, welche Feature-Fragen Kaufinteressenten stellen. | Bewertungsportal mit echten Nutzerfeedbacks, das direkt als Suchziel konkurrierender Keywords auftritt. | Relevant weil viele Interessenten die DATEV-Schnittstelle als K.o.-Kriterium behandeln und dort recherchieren.","https://www.zvoove.com/produkte — Eigene Produktseite als inhaltliche Referenz und Gap-Analyse: Was fehlt dort an Tiefe, das der Artikel liefern kann. | https://www.softgarden.de/ressourcen/glossar/ — Vergleichsplattform-Inhalte zeigen, welche Feature-Fragen Kaufinteressenten stellen. | https://www.capterra.com.de/software/133131/zvoove — Bewertungsportal mit echten Nutzerfeedbacks, das direkt als Suchziel konkurrierender Keywords auftritt. | https://www.datev.de/web/de/datev-shop/personalwirtschaft/ — Relevant weil viele Interessenten die DATEV-Schnittstelle als K.o.-Kriterium behandeln und dort recherchieren.","Leser werden eingeladen, eine persönliche Produktdemo von zvoove zu buchen, idealerweise mit dem Hinweis, dass in der Demo gezielt auf das eigene Betriebsmodell (Zeitarbeit, Direktvermittlung oder gemischt) eingegangen wird.",output/briefings/cluster_04.md,briefings/cluster_04.md
8,9,6,false,Liquidität Equal Pay und Tariflandschaft,Liquidity Equal Pay and Collective Agreements,34,15571,157,33.3,33,2.49,12.9,18.0,informational,debitorenmanagement | equal pay zeitarbeit | zahlungsausfall absichern | liquidität zeitarbeit | tariflandschaft zeitarbeit,debitorenmanagement | equal pay zeitarbeit | igz tarifvertrag aktuell,kosten | equal | tarifvertrag | factoring | liquidität | aktuell,"Liquidität in der Zeitarbeit sichern: Equal Pay, Tariflandschaft und Debitorenmanagement im Überblick",liquidität zeitarbeit,equal pay zeitarbeit | debitorenmanagement | igz tarifvertrag aktuell | bap tarif aktuell | tariflandschaft zeitarbeit | zahlungsausfall absichern | zahlungsziele kunden,"mixed, Zeitarbeitsunternehmen suchen sowohl grundlegendes Orientierungswissen zu Tarifen und Equal Pay als auch konkrete Handlungsoptionen zum Schutz ihrer Liquidität.",2800,"Geschäftsführer oder kaufmännischer Leiter eines mittelständischen Zeitarbeitsunternehmens mit 50 bis 300 Mitarbeitern, der die Marge unter Druck sieht und gleichzeitig steigende Lohnkosten durch Equal Pay und Tarifanpassungen managen muss.","Tariferhöhungen bei IGZ und BAP plus Equal-Pay-Pflicht ab dem 15. Einsatzmonat erhöhen die Lohnkosten sprunghaft, während Kundenzahlungsziele von 30 bis 60 Tagen die Liquidität dauerhaft belasten. Ein einziger Zahlungsausfall eines größeren Kunden kann die gesamte Vorfinanzierung der Löhne gefährden. Wer die aktuelle Tariflandschaft nicht im Griff hat, kalkuliert Angebote falsch und verliert entweder Marge oder Aufträge.","Der Leser soll nach dem Lesen verstehen, wie Equal Pay, aktuelle Tarifentwicklungen und strukturiertes Debitorenmanagement zusammenhängen, und konkrete Maßnahmen kennen, mit denen er seine Liquidität planbar hält.","Liquidität in der Zeitarbeit sichern: Equal Pay, Tariflandschaft und Debitorenmanagement im Überblick","Warum Liquidität in der Zeitarbeit strukturell schwierig ist | Die aktuelle Tariflandschaft: IGZ und BAP im Vergleich | Equal Pay in der Zeitarbeit: Was genau gilt ab dem 15. Einsatzmonat | Debitorenmanagement: Zahlungsausfälle verhindern, bevor sie entstehen | Zahlungsausfall absichern: Instrumente im Überblick | Lohnsteuer und Sozialabgaben in der Zeitarbeit: Compliance als Liquiditätsfaktor | Fazit: Liquiditätsplanung als strategische Aufgabe, nicht als Feuerlöscheinsatz","Offizielle IGZ-Tarifseite, direkt referenziert von Suchenden nach aktuellem IGZ-Tarifvertrag, hohe thematische Autorität | BAP-Tarifübersicht, vergleichbar mit IGZ-Seite und für die Gegenüberstellung beider Systeme unverzichtbar | Gut strukturierter Ratgeberartikel zu Equal Pay mit rechtlicher Tiefe, zeigt welche Detailtiefe Suchende bei diesem Thema erwarten","https://www.igz.de/tarifvertrag — Offizielle IGZ-Tarifseite, direkt referenziert von Suchenden nach aktuellem IGZ-Tarifvertrag, hohe thematische Autorität | https://www.bap.de/tarifvertrag — BAP-Tarifübersicht, vergleichbar mit IGZ-Seite und für die Gegenüberstellung beider Systeme unverzichtbar | https://www.haufe.de/personal/haufe-personal-office-platin/equal-pay-in-der-arbeitnehmeruberlassung — Gut strukturierter Ratgeberartikel zu Equal Pay mit rechtlicher Tiefe, zeigt welche Detailtiefe Suchende bei diesem Thema erwarten","Demo von zvoove buchen: Zeigen lassen, wie zvoove die Equal-Pay-Fälligkeit je Mitarbeiter automatisch trackt, aktuelle Tarifentwicklungen in die Lohnkalkulation einspielt und offene Posten im Debitorenmanagement übersichtlich darstellt, damit Liquiditätslücken sichtbar werden, bevor sie entstehen.",output/briefings/cluster_09.md,briefings/cluster_09.md
4,5,7,false,Sammelthemen Lohnabrechnung und Recruiting,Catch-all Payroll and Recruitment,32,14455,176,34.1,35,2.58,13.8,22.0,mixed,aüg | bewerber finden | lohnabrechnung sage | indeed alternative | offboarding prozess,aüg | bewerber finden | lizenzmodell saas,lohnabrechnung | stellenanzeige | alternative | erstellen | bewerber | finden,"Lohnabrechnung, Recruiting und AÜG: Der große Überblick für Personaldienstleister",lohnabrechnung erstellen,AÜG | bewerber finden | indeed alternative | stellenanzeige schalten | offboarding prozess | lohnabrechnung muster | lohnabrechnung sage,"mixed, Nutzer suchen teils nach praktischen Anleitungen (Muster, Erstellung), teils nach konkreten Softwarelösungen und Alternativen zu bekannten Tools.",2800,"Geschäftsführer oder HR-Leiter eines mittelständischen Personaldienstleisters oder einer Zeitarbeitsfirma mit 10 bis 100 Mitarbeitern, der seine Prozesse rund um Abrechnung und Recruiting konsolidieren will.","Lohnabrechnung, Bewerbermanagement und gesetzeskonforme AÜG-Dokumentation laufen in vielen Betrieben noch in drei verschiedenen Tools oder sogar in Excel, was zu Fehlern, Fristverstößen und vermeidbarem Zeitaufwand führt. Wechselnde Tarifverträge und AÜG-Pflichten machen jede manuelle Abrechnung zum Risiko, besonders wenn im gleichen Monat Leiharbeitnehmer zwischen Kundenbetrieben wechseln. Gleichzeitig wird der Fachkräftemangel spürbarer, sodass der Druck wächst, Stellen schneller zu besetzen, ohne teure Jobbörsen blind zu buchen.","Der Leser soll verstehen, wie er Lohnabrechnung, AÜG-Compliance und Recruiting in einem durchgängigen Prozess organisiert, und dabei konkret prüfen, ob eine spezialisierte All-in-one-Software wie zvoove den bisherigen Flickenteppich ersetzen kann.","Lohnabrechnung, Recruiting und AÜG: So bringen Personaldienstleister alle Prozesse unter einen Hut",Warum Personaldienstleister besondere Anforderungen haben | Lohnabrechnung erstellen: Grundlagen und gesetzliche Mindestanforderungen | Bewerber finden in einem leergefegten Markt | Offboarding Prozess: Das unterschätzte Ende des Arbeitsverhältnisses | SaaS-Lizenzmodelle für Personaldienstleister: Was passt zu welcher Firmengröße | All-in-one oder Best-of-Breed: Welcher Ansatz gewinnt in der Praxis | Fazit und nächste Schritte,"direkter Wettbewerber mit hoher Domain Authority, rankt auf mehrere der Ziel-Keywords und setzt den inhaltlichen Standard für den Abschnitt zur Lohnabrechnung | redaktionell starke Compliance-Ressource, zeigt wie AÜG-Inhalte für Praktiker aufbereitet werden sollten | relevant als Referenz für den Abschnitt zu Stellenanzeigen und Indeed-Alternativen, liefert Vergleichswerte zu CPCs","https://www.sage.com/de-de/blog/lohnabrechnung-erstellen/ — direkter Wettbewerber mit hoher Domain Authority, rankt auf mehrere der Ziel-Keywords und setzt den inhaltlichen Standard für den Abschnitt zur Lohnabrechnung | https://www.haufe.de/personal/hr-management/zeitarbeit-aueg/ — redaktionell starke Compliance-Ressource, zeigt wie AÜG-Inhalte für Praktiker aufbereitet werden sollten | https://www.indeed.com/lead/cost-per-click-jobwerbung — relevant als Referenz für den Abschnitt zu Stellenanzeigen und Indeed-Alternativen, liefert Vergleichswerte zu CPCs","Demo von zvoove buchen: Leser werden direkt eingeladen, sich in einer 30-minütigen Live-Demo zeigen zu lassen, wie zvoove Lohnabrechnung nach AÜG, Multiposting und Offboarding in einer Oberfläche vereint, inklusive kurzem Selbst-Check-Formular mit drei Fragen zur aktuellen Softwarelandschaft im Betrieb.",output/briefings/cluster_05.md,briefings/cluster_05.md
