cluster_id,display_id,rank_by_sv,is_noise,label_de,label_en,n_keywords,total_search_volume,median_search_volume,mean_kd,median_kd,mean_cpc_eur,mean_priority,pct_commercial,intent_dominant,top_keywords_by_sv,top_keywords_by_priority,top_terms,brief_title,brief_main_keyword,brief_secondary_keywords,brief_search_intent_text,brief_recommended_word_count,brief_target_audience,brief_pain_point,brief_article_goal,brief_h1,brief_h2_outline,brief_content_gaps,brief_benchmark_urls,brief_cta,brief_source_path,brief_md_path
11,12,8,false,Arbeitnehmerüberlassung Recht und Sozialversicherung,Employee Leasing Law and Social Insurance,44,14429,154,30.7,30,1.81,9.2,2.0,informational,arbeitnehmerüberlassung | arbeitnehmerüberlassungsgesetz | einkommensteuer zeitarbeit | arbeitsschutz zeitarbeit | arbeitgeberanteile sozialversicherung,arbeitnehmerüberlassungsgesetz | arbeitnehmerüberlassung | arbeitsmarkt 2026,arbeitsvertrag | arbeitsmarkt | arbeitnehmerüberlassung | sozialversicherung | employer | branding,"Arbeitnehmerüberlassung: Recht, Sozialversicherung und Pflichten im Überblick",Arbeitnehmerüberlassung,Arbeitnehmerüberlassungsgesetz | Arbeitgeberanteile Sozialversicherung | Arbeitsschutz Zeitarbeit | Einkommensteuer Zeitarbeit | Arbeitszeitkonto führen | Disposition Zeitarbeitnehmer,"informational, weil Suchende primär rechtliche Grundlagen, Pflichten und Prozesse verstehen wollen, bevor sie kaufen oder handeln.",2800,"Personalleiter oder Geschäftsführer eines mittelständischen Zeitarbeitsunternehmens (10 bis 100 Mitarbeiter intern), der seine Compliance-Prozesse professionalisieren und Haftungsrisiken reduzieren will.","Gesetzliche Änderungen im AÜG, bei Sozialversicherungspflichten und im Arbeitsschutz kommen schnell, aber im Tagesgeschäft bleibt kaum Zeit, den Überblick zu behalten. Fehler bei der Überlassungshöchstdauer, bei Gleichstellungsgeboten oder bei der Sozialversicherungsmeldung kosten nicht nur Bußgeld, sondern gefährden die Betriebserlaubnis. Wer Arbeitszeitkonten falsch führt oder die Disposition nicht sauber dokumentiert, sitzt bei einer Prüfung durch den Zoll oder die Deutsche Rentenversicherung schnell in der Klemme.","Der Leser soll die zentralen Rechtspflichten bei der Arbeitnehmerüberlassung kennen, häufige Compliance-Fehler vermeiden und verstehen, wie Software diese Prozesse absichert.","Arbeitnehmerüberlassung: Rechtliche Pflichten, Sozialversicherung und sichere Disposition","Was das Arbeitnehmerüberlassungsgesetz konkret von Zeitarbeitsfirmen verlangt | Sozialversicherung in der Zeitarbeit: Was Arbeitgeber zahlen und melden müssen | Einkommensteuer in der Zeitarbeit: Was Arbeitnehmer wissen müssen und was Arbeitgeber beachten | Arbeitsschutz in der Zeitarbeit: Doppelte Verantwortung, doppeltes Risiko | Arbeitszeitkonten richtig führen: Anforderungen und typische Fehler | Disposition von Zeitarbeitnehmern: Rechtliche Fallstricke in der Praxis | Wie Software Compliance in der Zeitarbeit absichert","umfassende Darstellung der AÜG-Grundlagen, hohe Autorität im HR-Rechtsbereich | offizielle Quelle der Bundesagentur für Arbeit zu Erlaubnispflichten, signifikant für E-E-A-T | Branchenverband mit aktuellem Tarifwerk, relevant für Equal Pay und Sozialversicherungsthemen","https://www.haufe.de/personal/arbeitsrecht/arbeitnehmerueberlassung-rechtliche-grundlagen — umfassende Darstellung der AÜG-Grundlagen, hohe Autorität im HR-Rechtsbereich | https://www.bundesagentur.de/arbeitnehmerueberlassung — offizielle Quelle der Bundesagentur für Arbeit zu Erlaubnispflichten, signifikant für E-E-A-T | https://www.igz.de/tarifvertraege — Branchenverband mit aktuellem Tarifwerk, relevant für Equal Pay und Sozialversicherungsthemen","Demo buchen: Zeig mir, wie zvoove die Überlassungsfristen, Sozialversicherungsmeldungen und Arbeitszeitkonten deiner Zeitarbeitnehmer automatisch überwacht und dokumentiert.",output/briefings/cluster_12.md,briefings/cluster_12.md
6,7,9,false,Personalverwaltung und Einsatzplanung,Personnel Management and Deployment Planning,34,12386,121,36.8,35,2.82,8.9,32.0,mixed,personaleinsatzplanung | personalakte inhalt | gehaltsabrechnung outsourcing | azubi verwaltung | karriereseite erstellen,personaleinsatzplanung | karriereseite erstellen | personalakte inhalt,personalakte | bewerbermanagement | lohnabrechnung | personaleinsatzplanung | inhalt | gehaltsabrechnung,Personaleinsatzplanung und Personalverwaltung: So behalten Personaldienstleister den Überblick,personaleinsatzplanung,personalakte inhalt | azubi verwaltung | lohnabrechnung personaldienstleister | kennzahlen personaldienstleister | saas personaldienstleister | gehaltsabrechnung outsourcing | ki bewerbermanagement,"mixed, Nutzer suchen teils nach Prozesswissen (was gehört in eine Personalakte, wie funktioniert Einsatzplanung), teils nach konkreten Softwarelösungen für Personaldienstleister.",2800,"Disponent oder Operations Manager in einem Personaldienstleistungs- oder Zeitarbeitsunternehmen mit 20 bis 200 Mitarbeitenden intern, der täglich mehrere Dutzend Mitarbeiter im Außeneinsatz koordiniert.","Excel-Tabellen und veraltete Tools reichen nicht mehr aus, sobald die Zahl der Einsatzkräfte wächst: Schichten werden doppelt vergeben, Qualifikationsnachweise fehlen bei der Kontrolle, und die Lohnabrechnung muss am Ende des Monats mühsam aus drei verschiedenen Quellen zusammengebaut werden. Dazu kommt der Druck durch Prüfungen nach dem Arbeitnehmerüberlassungsgesetz: Wer keine saubere digitale Personalakte führt, riskiert Bußgelder und verliert im schlimmsten Fall seine AÜG-Lizenz. Gleichzeitig fehlt die Zeit, sich in komplexe Softwareprojekte einzuarbeiten, während das Tagesgeschäft weiterläuft.","Der Leser soll verstehen, welche Prozesse in der Personalverwaltung und Einsatzplanung zusammenspielen, wo typische Fehlerquellen liegen, und warum eine integrierte SaaS-Lösung diese Probleme strukturell löst statt nur einzelne Symptome zu behandeln.",Personaleinsatzplanung und Personalverwaltung: So behalten Personaldienstleister den Überblick,"Warum Personaldienstleister besondere Anforderungen haben | Personaleinsatzplanung: Was wirklich dahintersteckt | Die digitale Personalakte: Pflichtinhalt und Best Practices | Lohnabrechnung und Gehaltsabrechnung: Outsourcing oder inhouse | Kennzahlen, die Personaldienstleister wirklich brauchen | KI im Bewerbermanagement und in der Einsatzplanung | SaaS für Personaldienstleister: Worauf es bei der Auswahl ankommt","Hohe Domain Authority, rankt auf generische Begriffe rund um Einsatzplanung, behandelt aber nicht die spezifischen Anforderungen von Personaldienstleistern | Stark für ""personalakte inhalt"", sehr informationslastig, kein Bezug zu Zeitarbeit oder AÜG | Direkter Wettbewerber im HR-Software-Segment, solide Abdeckung, aber kein Fokus auf Lohn-Schnittstellen oder Kennzahlen","https://www.sage.com/de-de/blog/personaleinsatzplanung/ — Hohe Domain Authority, rankt auf generische Begriffe rund um Einsatzplanung, behandelt aber nicht die spezifischen Anforderungen von Personaldienstleistern | https://www.haufe.de/personal/hr-management/personalakte-was-gehoert-rein_80_479768.html — Stark für ""personalakte inhalt"", sehr informationslastig, kein Bezug zu Zeitarbeit oder AÜG | https://www.perbit.de/hr-wissen/personaleinsatzplanung/ — Direkter Wettbewerber im HR-Software-Segment, solide Abdeckung, aber kein Fokus auf Lohn-Schnittstellen oder Kennzahlen","Demo buchen: Zeige dem Leser, wie zvoove in einer Live-Demo Einsatzplanung, digitale Personalakte und Lohnabrechnung in einem System verbindet, mit einem direkten Link zur Demo-Anfrage und dem konkreten Hinweis, dass keine IT-Kenntnisse für den Einstieg nötig sind.",output/briefings/cluster_07.md,briefings/cluster_07.md
2,3,10,false,KI-gestützte Recruiting Automatisierung,AI-Powered Recruiting Automation,34,12075,152,37.2,38,3.28,10.4,44.0,mixed,ki recruiting | recruiting software | recruiting plattform | automatisierung recruiting prozess | active sourcing tools,ki recruiting | candidate experience verbessern | automatisierung recruiting prozess,recruiting | sourcing | tool | chatbot | candidate | konkurrenz,KI im Recruiting: So automatisieren Personaldienstleister ihren gesamten Bewerbungsprozess,ki recruiting,recruiting automatisieren | recruiting software | recruiting plattform | recruiting tool zeitarbeit | automatisierung recruiting prozess | applicant tracking system deutsch | ki im recruiting,"mixed, Nutzer recherchieren sowohl nach Grundlagen zu KI im Recruiting als auch nach konkreten Tools und Plattformen für den Einsatz im Tagesgeschäft.",2800,"Niederlassungsleiter oder Recruiting-Verantwortliche in einem Personaldienstleistungsunternehmen mit 5 bis 50 Mitarbeitern, der täglich zu viele Stellen zu besetzen hat und zu wenig Zeit für manuelle Prozesse.","Die Stellenbesetzungszeiten steigen, während qualifizierte Bewerber in Minuten von Wettbewerbern abgefangen werden, weil interne Prozesse noch auf E-Mail und Excel basieren. Das Tagesgeschäft lässt kaum Raum, jeden Kandidaten im richtigen Moment anzusprechen, Lebensläufe manuell zu sichten kostet Stunden, die schlicht nicht da sind. Gleichzeitig wächst der Druck von Kundenunternehmen, Vakanzen schneller zu besetzen, und jede verzögerte Besetzung ist direkt entgangener Umsatz.","Der Leser soll verstehen, welche Schritte im Recruiting durch KI und Automatisierung konkret abgedeckt werden können, und eine fundierte Entscheidungsgrundlage haben, welche Art von Software für Personaldienstleister und Zeitarbeitsfirmen sinnvoll ist.",KI im Recruiting: So automatisieren Personaldienstleister ihren gesamten Bewerbungsprozess,"Warum manuelle Recruiting-Prozesse Personaldienstleister Umsatz kosten | Was KI im Recruiting konkret bedeutet, jenseits des Hypes | Der Recruiting Funnel im Überblick: Wo Automatisierung den größten Hebel hat | Applicant Tracking System vs. All-in-One-Plattform: Was Personaldienstleister wirklich brauchen | Active Sourcing mit KI: Kandidaten finden, bevor sie aktiv suchen | Rechtliche Grenzen: Was bei KI-gestütztem Recruiting in Deutschland zu beachten ist | Einführung eines KI-Recruiting-Tools: Typische Fehler und wie man sie vermeidet","Hoch rankender Grundlagenartikel von einem bekannten HR-Software-Anbieter, zeigt die Erwartungshaltung der Zielgruppe an Tiefe und Struktur | Redaktionell starker Artikel mit Praxisbezug, relevant wegen der Abdeckung rechtlicher Aspekte und Nutzerzitate | Direkt konkurrierendes Tool erklärt ATS-Grundlagen, zeigt welche Keywords in einem Artikel sinnvoll gebündelt werden","https://www.personio.de/hr-lexikon/ki-recruiting/ — Hoch rankender Grundlagenartikel von einem bekannten HR-Software-Anbieter, zeigt die Erwartungshaltung der Zielgruppe an Tiefe und Struktur | https://www.haufe.de/personal/hr-management/ki-im-recruiting_80_596160.html — Redaktionell starker Artikel mit Praxisbezug, relevant wegen der Abdeckung rechtlicher Aspekte und Nutzerzitate | https://www.softgarden.com/ressourcen/glossar/applicant-tracking-system/ — Direkt konkurrierendes Tool erklärt ATS-Grundlagen, zeigt welche Keywords in einem Artikel sinnvoll gebündelt werden","Demo von zvoove Recruit buchen: Leser werden eingeladen, sich in einer 30-minütigen Live-Demo zeigen zu lassen, wie zvoove den Recruiting Funnel vom Stelleneingang bis zur Vermittlung automatisiert, inklusive KI-gestütztem Matching und integriertem Bewerbermanagement für Zeitarbeitsunternehmen.",output/briefings/cluster_03.md,briefings/cluster_03.md
5,6,11,false,Zeitarbeit Markt und Regulierung Deutschland,Staffing Market and German Regulations,20,11462,156,33.0,32,2.02,17.6,5.0,informational,höchstüberlassungsdauer | fachkräftemangel deutschland | gig economy deutschland | gesetzliche abzüge lohn | markt zeitarbeit deutschland,fachkräftemangel deutschland | höchstüberlassungsdauer | gig economy deutschland,deutschland | erlaubnis | höchstüberlassungsdauer | überlassungsvertrag | statistik | fachkräftemangel,"Zeitarbeit in Deutschland 2025: Marktdaten, AÜG-Regeln und was Verleiher wirklich wissen müssen",markt zeitarbeit deutschland,höchstüberlassungsdauer | aüg statistik meldung | sanktionen aüg verstoß | ranking zeitarbeitsfirmen deutschland | überlassungsvertrag inhalt | fachkräftemangel deutschland zeitarbeit | gig economy deutschland,"mixed, Betreiber und Compliance-Verantwortliche in Zeitarbeitsunternehmen suchen sowohl Marktdaten zur eigenen Orientierung als auch konkrete Regelungsfragen rund um das AÜG.",2800,"Geschäftsführer oder Niederlassungsleiter einer mittelgroßen Zeitarbeitsfirma mit 50 bis 500 aktiven Leiharbeitnehmern, der den eigenen Marktanteil einordnen und gleichzeitig sichergehen will, keine AÜG-Verstöße zu riskieren.","Der Markt für Zeitarbeit schrumpft oder stagniert in manchen Segmenten, während der Fachkräftemangel gleichzeitig den Druck erhöht, schneller und flexibler zu besetzen. Wer die Höchstüberlassungsdauer oder Meldefristen der Bundesagentur für Arbeit nicht im Griff hat, riskiert empfindliche Bußgelder und den Entzug der Erlaubnis. Viele Unternehmen wissen nicht genau, wo sie im Vergleich zum Wettbewerb stehen und welche regulatorischen Stolpersteine 2025 besonders gefährlich sind.","Der Leser soll nach dem Lesen die aktuelle Marktlage einordnen können, die drei kritischsten AÜG-Pflichten kennen und einschätzen, wo sein Unternehmen im Branchenvergleich steht.","Zeitarbeit in Deutschland 2025: Marktdaten, AÜG-Regeln und was Verleiher wirklich wissen müssen","Der deutsche Zeitarbeitsmarkt in Zahlen | AÜG-Meldepflichten: Was viele Verleiher falsch machen | Höchstüberlassungsdauer: Die 18-Monats-Regel in der Praxis | Sanktionen bei AÜG-Verstößen: Bußgelder, Erlaubnisentzug und zivilrechtliche Folgen | Der Überlassungsvertrag: Pflichtinhalte und häufige Lücken | Gig Economy und neue Beschäftigungsmodelle: Bedrohung oder Ergänzung für Zeitarbeit? | Gesetzliche Abzüge und Equal Pay: Was Verleiher beim Lohn beachten müssen","Branchenverband mit aktuellen Marktdaten und AÜG-Statistiken, hohe Relevanz für Zahlen und Ranking | Gut rankender Ratgeberartikel zur Höchstüberlassungsdauer mit konkreten Praxisbeispielen | Offizielle Quelle der BA zu Erlaubnispflicht und Meldeverfahren, wird oft zitiert und verlinkt","https://www.igz.de/presse/statistiken/ — Branchenverband mit aktuellen Marktdaten und AÜG-Statistiken, hohe Relevanz für Zahlen und Ranking | https://www.haufe.de/personal/hr-management/zeitarbeit-ueberlassungshoechstdauer_80_404810.html — Gut rankender Ratgeberartikel zur Höchstüberlassungsdauer mit konkreten Praxisbeispielen | https://www.bundesagentur.de/DE/Unternehmen/Beschaeftigung/AUG/aug-nav.html — Offizielle Quelle der BA zu Erlaubnispflicht und Meldeverfahren, wird oft zitiert und verlinkt","Jetzt kostenlosen Demo-Termin vereinbaren und sehen, wie zvoove Zeitarbeit Fristen zur Höchstüberlassungsdauer, AÜG-Meldepflichten und Vertragsdokumentation automatisch im Griff behält.",output/briefings/cluster_06.md,briefings/cluster_06.md
9,10,12,false,Gebäudereinigung Disposition und Kalkulation,Facility Cleaning Scheduling and Costing,27,8467,136,40.2,39,4.35,6.7,52.0,mixed,gebäudereinigung software | disposition gebäudereinigung | auftragsverwaltung gebäudereinigung | reinigungskalkulation software | unterhaltsreinigung kalkulation,gebäudereinigung software | gebäudereinigung digitalisieren | disposition gebäudereinigung,gebäudereinigung | reinigung | zeiterfassung | kalkulation | gebäudedienstleistung | reinigungskräfte,"Gebäudereinigung Software: Disposition, Kalkulation und Zeiterfassung im Überblick",gebäudereinigung software,disposition gebäudereinigung | auftragsverwaltung gebäudereinigung | reinigungskalkulation software | unterhaltsreinigung kalkulation | zeiterfassung gebäudereinigung | gebäudereinigung digitalisieren | qualitätsmanagement gebäudereinigung,"mixed, Betreiber von Reinigungsunternehmen suchen aktiv nach einer Softwarelösung, wollen aber vorher verstehen, welche Funktionen wirklich notwendig sind und was eine Einführung kostet.",2800,"Geschäftsführer oder Disponenten eines mittelständischen Gebäudereinigungsunternehmens mit 20 bis 200 Mitarbeitern, das bisher mit Excel, Papier oder veralteten Insellösungen arbeitet.","Aufträge werden manuell koordiniert, Touren laufen ineffizient, und der Disponent verliert täglich Zeit mit Telefonaten, weil niemand weiß, wer gerade wo eingesetzt ist. Kalkulationsfehler bei Unterhaltsreinigungsverträgen fressen die Marge, weil Reinigungszeiten falsch geschätzt werden und Nachkalkulation kaum stattfindet. Bei Betriebsprüfungen oder Kundenreklamationen fehlen saubere Nachweise über geleistete Stunden und Qualitätskontrollen.","Der Leser soll verstehen, welche Kernfunktionen eine Software für Gebäudereiniger braucht, wie eine Einführung konkret abläuft, und warum er mit zvoove eine Demo vereinbaren sollte, bevor er eine Kaufentscheidung trifft.","Gebäudereinigung Software: Disposition, Kalkulation und Zeiterfassung endlich digital","Warum Excel und Telefon in der Gebäudereinigung ausgedient haben | Die fünf Kernfunktionen, die eine Reinigungssoftware mitbringen muss | Disposition in der Gebäudereinigung: Wie gute Software den Alltag verändert | Reinigungskalkulation: Angebote gewinnen, ohne die Marge zu opfern | Zeiterfassung in der Gebäudereinigung: Rechtssicher und einfach für Reinigungskräfte | Softwareeinführung in einer Reinigungsfirma: Was wirklich auf Sie zukommt | Gebäudedienstleistung digitalisieren: Schritt für Schritt zum papierlosen Betrieb","Marktübersicht eines Branchenportals, deckt viele der Nebenkeywords ab und rankt bereits für mehrere Clusterbegriffe | Praxisbericht eines mittelständischen Reinigungsunternehmens, hohe inhaltliche Glaubwürdigkeit durch Erfahrungswerte | Fachmagazin-Artikel mit Produktvergleich, liefert Kontext zu Wettbewerbern und Kaufkriterien","https://www.spectos.com/blog/gebaeudereinigung-software — Marktübersicht eines Branchenportals, deckt viele der Nebenkeywords ab und rankt bereits für mehrere Clusterbegriffe | https://www.stherm.de/blog/digitalisierung-gebaeudereinigung — Praxisbericht eines mittelständischen Reinigungsunternehmens, hohe inhaltliche Glaubwürdigkeit durch Erfahrungswerte | https://www.facility-manager.de/themen/digitalisierung/software-fuer-gebaeudereiniger — Fachmagazin-Artikel mit Produktvergleich, liefert Kontext zu Wettbewerbern und Kaufkriterien","Jetzt eine kostenlose Demo von zvoove für Gebäudereiniger vereinbaren und live sehen, wie Disposition, Kalkulation und Zeiterfassung in einer Plattform zusammenspielen.",output/briefings/cluster_10.md,briefings/cluster_10.md
0,1,13,false,Factoring Buchhaltung und Genehmigung,Factoring Accounting and Licensing,15,3516,161,35.7,39,3.23,8.4,27.0,mixed,factoring buchen | factoring erlaubnis | offenes factoring | echtes factoring | factoring kfw,factoring buchen | factoring erlaubnis | echtes factoring,factoring | online | buchen | erlaubnis | offenes | echtes,"Factoring für Zeitarbeit: Buchen, Genehmigung und Anbieter im Überblick",factoring buchen,factoring erlaubnis | offenes factoring | stilles factoring | echtes factoring | unechtes factoring | factoring vergleich anbieter | factoring online beantragen,"mixed, Leser suchen sowohl grundlegendes Verständnis zu Factoring-Varianten als auch konkrete Handlungsoptionen wie Anbieterauswahl und Buchhaltungsbehandlung.",2500,"Kaufmännische Leitung oder Geschäftsführer eines mittelständischen Zeitarbeitsunternehmens mit 20 bis 200 Mitarbeitern, der Liquiditätsengpässe zwischen Lohnauszahlung und Kundenzahlung schließen will.","Zeitarbeitsunternehmen zahlen Löhne wöchentlich oder vierzehntägig, bekommen ihr Geld von Kundenunternehmen aber erst nach 30 bis 60 Tagen. Dieser strukturelle Liquiditätsengpass zwingt viele Unternehmen in teure Kontokorrentkredite oder bremst das Wachstum. Dazu kommt Unsicherheit: Brauche ich eine Erlaubnis für Factoring, wie buche ich die Transaktionen korrekt, und welcher Anbieter passt zu meiner Betriebsgröße?","Der Leser soll nach dem Lesen verstehen, welche Factoring-Variante für sein Zeitarbeitsunternehmen passt, wie er die Buchungen korrekt abbildet und welche nächsten Schritte zur Beantragung sinnvoll sind.","Factoring in der Zeitarbeit: Buchen, Genehmigung und die richtige Anbieterauswahl",Warum Factoring für Zeitarbeitsunternehmen ein Dauerthema ist | Die wichtigsten Factoring-Varianten im Vergleich | Factoring buchen: So läuft die Buchhaltung korrekt ab | Factoring Erlaubnis: Was rechtlich zu beachten ist | Factoring online beantragen: So läuft der Prozess heute ab | Factoring Anbieter vergleichen: Worauf es in der Zeitarbeit wirklich ankommt | Factoring und Zeitarbeitssoftware: Wenn beides zusammenspielt,"Hochrangiger Ratgeberartikel zu Buchungssätzen, direkt auf das Hauptkeyword optimiert | Klarer, praxisnaher Aufbau mit Buchungsbeispielen, gut verlinkt im KMU-Segment | Spezialisierte Branchenseite mit Fokus auf Erlaubnispflicht und BaFin-Thematik","https://www.haufe.de/finance/buchfuehrung-kontierung/factoring-buchen_112_474338.html — Hochrangiger Ratgeberartikel zu Buchungssätzen, direkt auf das Hauptkeyword optimiert | https://www.billomat.com/magazin/buchhaltung/factoring-buchen/ — Klarer, praxisnaher Aufbau mit Buchungsbeispielen, gut verlinkt im KMU-Segment | https://www.factoring.de/factoring-wissen/factoring-erlaubnis/ — Spezialisierte Branchenseite mit Fokus auf Erlaubnispflicht und BaFin-Thematik","Demo vereinbaren: Zeig mir, wie zvoove die Rechnungsstellung automatisiert und damit die Voraussetzung für schnelles Factoring schafft.",output/briefings/cluster_01.md,briefings/cluster_01.md
